<?xml version="1.0" encoding="utf-8" standalone="no"?>
<beercostList xmlns:xsi="http://www.w3.org/2001/XMLSchema-instance" 
			  xsi:noNamespaceSchemaLocation="Beercost.xsd">
	<beercost>
		<year>
			2013
		</year>
		<team>
			<teamName>
				Arizona Diamondbacks
			</teamName>
			<nickname>
				Diamondbacks
			</nickname>
			<city>
				Arizona
			</city>
		</team>
		<beer valuta="Dollar" unit="Ounce">
			<price>
				4.0
			</price>
			<size>
				14.0
			</size>
			<price_per_Ounce >
				0.2857142857142857
			</price_per_Ounce>
		</beer>
	</beercost>
</beercostList>